{
  "schema_version": "lazurio.install.report.v2",
  "mode": "report",
  "status": "action_required",
  "machine": {
    "platform": "darwin",
    "architecture": "arm64",
    "bun": {
      "status": "current",
      "current_version": "1.4.2",
      "required_version": "1.4.2"
    },
    "node": {
      "status": "compatible",
      "current_version": "24.19.0",
      "required_range": ">=22.12.0"
    }
  },
  "root": {
    "selected": true,
    "path": "/Users/example/Lazurio",
    "layout": "missing"
  },
  "steps": [
    {
      "id": "platform",
      "status": "completed",
      "reason": "platform_supported"
    },
    {
      "id": "bun",
      "status": "completed",
      "reason": "bun_runtime_current"
    },
    {
      "id": "git",
      "status": "completed",
      "reason": "git_available"
    },
    {
      "id": "github_cli",
      "status": "action_required",
      "reason": "github_cli_missing"
    },
    {
      "id": "node",
      "status": "completed",
      "reason": "node_runtime_compatible"
    },
    {
      "id": "codex",
      "status": "action_required",
      "reason": "codex_missing"
    },
    {
      "id": "github_auth",
      "status": "skipped",
      "reason": "github_cli_unavailable"
    },
    {
      "id": "root",
      "status": "action_required",
      "reason": "root_creation_required"
    }
  ],
  "summary": {
    "status": "action_required",
    "counts": {
      "completed": 4,
      "skipped": 1,
      "action_required": 3,
      "failed": 0
    }
  }
}
